{
  "$schema": "http://json-schema.org/draft-07/schema#",
  "$id": "https://bindle/schemas/architecture/v1/config.schema.json",
  "title": "architecture v1 projection configuration",
  "description": "Operator-owned projection settings for one project. Apply is READ-ONLY on this file: it carries no marker contract and no byte-preservation guarantee, so a machine write could silently reformat or drop hand-maintained exclusions.",
  "type": "object",
  "additionalProperties": false,
  "required": [
    "schema_version",
    "projection_schema_version",
    "project_id",
    "project_slug",
    "bindings",
    "caps",
    "thresholds",
    "diff_size_confirmation_limit"
  ],
  "properties": {
    "schema_version": { "const": 1 },
    "projection_schema_version": { "type": "integer", "minimum": 1 },
    "project_id": {
      "type": "string",
      "pattern": "^project:[0-9a-f]{32}$",
      "description": "A mismatch against the project being projected is a HARD ABORT, not a finding."
    },
    "project_slug": { "type": "string", "pattern": "^[a-z0-9]+(-[a-z0-9]+)*$" },
    "display_name": { "type": "string" },
    "bindings": {
      "type": "array",
      "description": "Participating repository bindings. Removing one is a `deconfigured` binding, retired through confirmation -- never carried forward like a transient `unavailable`.",
      "items": {
        "type": "object",
        "additionalProperties": false,
        "required": ["binding_id", "alias"],
        "properties": {
          "binding_id": {
            "type": "string",
            "pattern": "^repository-binding:[0-9a-f]{32}$"
          },
          "alias": { "type": "string" }
        }
      }
    },
    "caps": {
      "type": "object",
      "additionalProperties": false,
      "required": ["max_nodes", "over_cap_behavior"],
      "properties": {
        "max_nodes": { "type": "integer", "minimum": 1 },
        "over_cap_behavior": {
          "enum": ["report"],
          "description": "The cap binds NEW CREATION only. Existing confirmed nodes over a lowered cap are reported for an explicit operator decision; silent enforcement and silent non-enforcement are both forbidden. AUTHORITATIVE SPELLING (#372): the run-scoped per-candidate flag this policy governs is `over_cap`. The contract previously carried a second spelling, `below_cap_threshold`, in some issue and design-doc text; it is one flag, not two, and `over_cap` wins because it is the spelling this frozen key, `state.OVER_CAP_BEHAVIORS` and merged `ranking.rank()` output all already use. `below_cap_threshold` is retired and must not be produced or consumed."
        }
      }
    },
    "thresholds": {
      "type": "object",
      "additionalProperties": false,
      "required": ["high", "low"],
      "properties": {
        "high": { "type": "number", "minimum": 0, "maximum": 1 },
        "low": { "type": "number", "minimum": 0, "maximum": 1 }
      }
    },
    "exclusions": {
      "type": "array",
      "items": { "type": "string" },
      "description": "Binds CANDIDATE GENERATION. A new exclusion never retro-deletes a confirmed node; until confirmation it reads as excluded_but_confirmed."
    },
    "diff_size_confirmation_limit": { "type": "integer", "minimum": 0 }
  }
}
